These were our 4 best — and 4 worst — portfolio stocks in the first ...,3/29/2024
"Huawei’s profit doubled in 2023 as smartphone, autos business picked up",3/29/2024
"Cramer on Apple: Own it, don’t trade it",3/29/2024
This semiconductor ETF is headed for its best quarterly gain in a year. Here are ...,3/28/2024
Apple’s bad quarter and what history says will happen next,3/28/2024
Xiaomi releases electric car $4K cheaper than Tesla’s Model 3 as price wars heat up,3/28/2024
Pro Talks: Katie Stockton on the one stock with a more explosive chart than Nvidia,3/28/2024
"Here are Thursday’s biggest analyst calls: Nvidia, Meta, Tesla, Apple, CyberArk, Grindr, Estee Lauder & ...",3/28/2024
TikTok makes $2.1 million TV ad buy as Senate reviews bill that could ban app,3/28/2024
Here’s a rapid-fire update on all 33 portfolio stocks including our latest buy,3/27/2024
Morgan Stanley’s Erik Woodring presents his bull case for Apple,3/27/2024
Amazon spends $2.75 billion on AI startup Anthropic in its largest venture investment yet,3/27/2024
The portfolio’s 5 best-performing stocks since the February Annual Meeting,3/27/2024
Why the government wants to rearrange your Apple Wallet,3/27/2024
Jim Cramer’s top 10 things to watch in the stock market Wednesday,3/27/2024
"Here are Wednesday’s biggest analyst calls: Apple, Nvidia, Tesla, Spotify, Marvell, Netflix, Disney, DraftKings & ...",3/27/2024
Apple’s rough start to the year,3/27/2024
Op-ed: Why an all-smiles China visit from Apple’s Tim Cook isn’t good business,3/27/2024
"Anta Sports’ China strategy makes ‘enormous amount of sense’, but its growth is ‘underappreciated’: Analyst",3/27/2024
CNBC Daily Open: U.S. consumers’ optimism wanes,3/27/2024
Are Apple’s best days behind it? Apple stock declines more than 11% in 2024,3/27/2024
"What’s behind Danaher’s decline, plus high hopes for Apple’s developers event",3/26/2024
"This chip stock is mounting another attempt at a breakout, according to the charts",3/26/2024
"Apple announces its big annual conference, where it could reveal its AI strategy",3/26/2024
"28-year-old actor lives in New York City on $17,000 a year: It’s stressful, but ’I’m ...",3/26/2024
"Here are Tuesday’s biggest analyst calls: Amazon, Nvidia, Reddit, Tesla, Apple, Seagate, Micron, Spotify, Gap ...",3/26/2024
"The EU probe into Big Tech companies is ‘effectively noise’, says Deepwater’s Gene Munster",3/26/2024
"EU investigations into Apple, Meta and Alphabet explained",3/26/2024
CNBC Daily Open: Inflation isn’t coming down fast enough,3/26/2024
"Apple could double down on China market, Wedbush says, as iPhone sales drop",3/26/2024
