Apple’s 9th-gen iPad doesn’t change much — and that’s not a bad thing,"Nov 26, 2023"
A clue that makes this podcaster think Taylor Swift will be engaged soon,"Nov 20, 2023"
Apple will make a big change to iPhone messages next year,"Nov 20, 2023"
Amazon’s Black Friday 2023 deals have arrived — here’s what to shop now,"Nov 20, 2023"
Iowa woman has been friends with Xi for 25 years. Hear what she thinks about him being called a dictator,"Nov 17, 2023"
"The best sales to shop today: Apple, Away, Madewell and more","Nov 16, 2023"
Japan’s most beautiful garden,"Nov 16, 2023"
House lawmakers press Apple CEO on reports Jon Stewart’s show was canceled over China concerns,"Nov 16, 2023"
Snapchat users can now buy Amazon products without leaving the app,"Nov 15, 2023"
"The best sales to shop today: Bala, Birthdate, Hill House and more","Nov 15, 2023"
The Nomad Strike Sport is a new twist on one of our favorite Apple Watch bands,"Nov 14, 2023"
Taylor Swift's song skyrockets on iTunes after she changed this lyric,"Nov 14, 2023"
Apple AirTags are on sale at Amazon for Black Friday,"Nov 21, 2023"
The 17 best Mac games to play in 2023,"Nov 13, 2023"
In pictures: American soccer star Megan Rapinoe,"Nov 12, 2023"
Pictures: The best Christmas markets around the world for 2023,"Nov 11, 2023"
Pictures: The family of seven hiking America’s longest trails together,"Nov 10, 2023"
The week in 33 photos,"Nov 10, 2023"
I just played Resident Evil 4 and Death Stranding on iPhone — this is a game changer,"Nov 9, 2023"
"Apple co-founder Steve Wozniak hospitalized in Mexico City, source says","Nov 9, 2023"
Apple’s fight against a $14 billion EU tax bill suffers a setback,"Nov 9, 2023"
Close-up photos reveal the weird and wonderful creatures living in soil,"Nov 8, 2023"
The M3 iMac makes Apple’s gorgeous all-in-one much more powerful,"Nov 7, 2023"
G7 countries prepare to gather in Japan,"Nov 7, 2023"
Apple’s M3 MacBook Pros are more affordable than before — and you can preorder now,"Nov 6, 2023"
Hollywood Minute: Taylor Swift's best first week ever,"Nov 6, 2023"
Barbra Streisand wasn’t happy with how Siri said her name. So she called up Apple’s CEO to get it fixed,"Nov 6, 2023"
iPhone 15 Pro vs. Google Pixel 8 Pro: Which smartphone is best?,"Nov 3, 2023"
Apple’s ‘scary fast’ upgrades hint at its vision for the AI era,"Nov 16, 2023"
"Photos: She was a Pan Am flight attendant, he was a pilot. Their inflight meeting sparked a 50 year romance","Nov 3, 2023"
Apple’s slower device sales continue to weigh on earnings,"Nov 2, 2023"
Apple unveils its fastest iMac and MacBook Pro models yet,"Nov 16, 2023"
Nomad’s new leather iPad case is a stunner,"Nov 2, 2023"
20 Amazon products our readers loved buying in October,"Nov 2, 2023"
Under $25 scores: Apple’s USB-C EarPods are some of the best wired earbuds around,"Nov 1, 2023"
Inside this quirky guitar maker’s biomaterial world,"Nov 1, 2023"
A photo tour of Doha’s new cruise terminal,"Nov 1, 2023"
Apple’s new M3 iMac is twice as fast and gaming-ready — and you can preorder now,"Oct 31, 2023"
Lonely Planet’s travel picks for 2024,"Oct 31, 2023"
What to expect from Apple’s ‘scary fast’ event,"Nov 16, 2023"
Apple Watch Series 9 review: Incrementally improving an already great smartwatch,"Dec 19, 2023"
Apple Watch Ultra 2 review: Still the smartwatch to get,"Oct 26, 2023"
iPhone 15 vs. iPhone 15 Pro: Which is best for you?,"Oct 26, 2023"
Pictures: The US couple who swapped California for Spain,"Oct 26, 2023"
Apple TV+ hikes price once again,"Nov 16, 2023"
Michael Cohen testifies in Trump civil fraud trial,"Oct 25, 2023"
Apple announces ‘scary fast’ October event,"Oct 24, 2023"
Google Pixel 8 vs. iPhone 15: Which phone is best for you?,"Oct 24, 2023"
Fukuoka: Japan’s street food capital,"Oct 23, 2023"
Jon Stewart’s show on Apple is over because of disagreements about China,"Oct 20, 2023"
"The best sales to shop this weekend: AirPods, LG, Breville and more","Oct 20, 2023"
Apple just revealed a new $79 Apple Pencil with USB-C — but is it right for you?,"Oct 19, 2023"
"The best sales to shop today: Roomba, Rtic, Philips Sonicare and more","Oct 19, 2023"
"The 10 best Amazon deals to shop this week: Logitech, Apple, Breville and more","Oct 19, 2023"
Apple continues its sweep to roll out USB-C to more devices,"Oct 18, 2023"
Hollywood Minute: Taylor Swift's global box office haul,"Oct 17, 2023"
"The best sales to shop today: Apple Watch, Logitech, Thermacell and more","Oct 17, 2023"
"The best sales to shop today: iPad, AeroGarden, Nespresso and more","Oct 17, 2023"
Time Out’s picks for cool neighborhoods,"Oct 17, 2023"
iPhone sales in China shrink as US political tensions grow,"Oct 16, 2023"
Taylor Swift thanks fans at her 'Eras Tour' movie premiere,"Oct 13, 2023"
The Pixel 8 Pro is my favorite Google phone ever,"Oct 13, 2023"
Don’t miss your chance to shop 238 of the best deals from Amazon Prime Day 2023,"Oct 12, 2023"
The best Lightning Deals to shop during October’s Amazon Prime Day 2023,"Oct 12, 2023"
The very best Apple deals still available for Amazon Prime Day 2023,"Oct 12, 2023"
Last chance to shop these 34 deals during Best Buy’s 48-hour shopping event on Prime Day,"Oct 11, 2023"
30 products our readers are buying before October’s Amazon Prime Day 2023 ends,"Oct 11, 2023"
Time is running out to shop these Amazon Prime Day 2023 AirPod deals,"Oct 11, 2023"
Grab the best Amazon device sales from October’s Prime Day 2023 — before it’s over,"Oct 11, 2023"
We found the best laptop deals still available for Amazon Prime Day,"Oct 11, 2023"
See Japanese 'ARCHAX' robot with $3 million price tag,"Oct 11, 2023"
The best iPhone deals you can get before Amazon Prime Day is over,"Oct 11, 2023"
We found the best iPad deals for October’s Amazon Prime Day 2023,"Oct 11, 2023"
The excellent MacBook Air M2 is down to its lowest-ever price for Amazon’s October Prime Day,"Oct 11, 2023"
We found the best iPad deals for October’s Amazon Prime Day 2023,"Oct 17, 2023"
The best Lightning Deals to shop during October’s Amazon Prime Day 2023,"Oct 11, 2023"
We found all of the best deals to shop during Amazon Prime Day 2023,"Oct 11, 2023"
The best Apple deals for October’s Amazon Prime Day,"Oct 10, 2023"
We found all of the best deals to shop during Amazon Prime Day 2023,"Oct 10, 2023"
Here are the best iPhone deals for October Amazon Prime Day,"Oct 10, 2023"
"AirPods Pro 2 are at an all-time low price for October’s Amazon Prime Day 2023, plus more AirPod deals","Nov 22, 2023"
Shop these 29 deals during Best Buy’s 48-hour shopping event on October’s Prime Day,"Oct 10, 2023"
The best Apple deals for October’s Amazon Prime Day,"Oct 10, 2023"
The best Amazon device sales from October’s Prime Day 2023,"Oct 10, 2023"
"The best tech deals from October Amazon Prime Day 2023, according to our editors","Oct 10, 2023"
We found the best iPad deals for October’s Amazon Prime Day 2023,"Oct 10, 2023"
The best Lightning Deals of Amazon Prime Day 2023,"Oct 10, 2023"
We found the best laptop deals for October’s Amazon Prime Day,"Oct 10, 2023"
How Amazon could end SpaceX's monopoly,"Oct 6, 2023"
A book of photography is helping to save leopards,"Oct 6, 2023"
"Apple rejected opportunities to buy Microsoft’s Bing, integrate with DuckDuckGo","Oct 5, 2023"
See what the White House said when questioned about Taylor Swift and Travis Kelce,"Oct 5, 2023"
"The 10 best Amazon deals to shop this week: Ninja, Levi’s, Adidas and more","Oct 4, 2023"
Pictures: The US family relocating to Italy for a brighter future,"Oct 4, 2023"
Traveling the Amazon River,"Oct 3, 2023"
Japan Airlines reveals cabins for new A350-1000 planes,"Oct 3, 2023"
Apple confirms that a bug and some apps are causing iPhone 15 models to overheat,"Oct 2, 2023"
The best leather Apple Watch bands for ultimate style and comfort,"Oct 2, 2023"
Swift-Kelce becomes America's latest obsession,"Oct 2, 2023"
Pictures: This woman is riding around the world with her puppy,"Oct 2, 2023"
"Taylor Swift is in her NFL era, and that's boosting sales for the league","Oct 2, 2023"
Game On: A James Bond iOS adventure,"Sep 29, 2023"
These iPhone 15 carrier deals make upgrading more affordable,"Oct 6, 2023"
MacOS Sonoma is worth upgrading to for any Mac user,"Oct 2, 2023"
iOS 17 is full of surprise and delight,"Sep 29, 2023"
"To the very end, ‘Physical’ put in the sweat to break down diet culture","Sep 28, 2023"
Taylor Swift's NFL game exit leads to fan speculation,"Sep 27, 2023"
iPhone 15 Pro review: Apple delivers the Action you didn’t know you needed,"Sep 27, 2023"
The US government is suing Amazon. How this might impact you,"Sep 27, 2023"
"The best sales to shop today: Apple, Shark, Tile and more","Sep 28, 2023"
U.S. government sues Amazon for alleged online monopoly,"Sep 27, 2023"
The London Tunnels is the UK capital’s most ambitious new tourism project,"Sep 26, 2023"
Taylor Swift's attendance at Chiefs game brings a spike in Travis Kelce jersey sales,"Sep 26, 2023"
What Huawei's latest fall line means for the tech giant,"Sep 25, 2023"
Traylor is that you? Gaming couple nicknames for Travis Kelce and Taylor Swift,"Sep 25, 2023"
Photos indicate Taylor Swift accepted NFL star's invite,"Sep 25, 2023"
Photos indicate Taylor Swift accepted NFL star's invite,"Sep 25, 2023"
iPhone 15 hits shelves around the world. Here’s what you need to know,"Sep 22, 2023"
Microsoft’s $800 Surface Laptop Go 3 is up for preorder — and we tried it early,"Sep 22, 2023"
Australia to host academic conference on Taylor Swift,"Sep 22, 2023"
Otto Group to use Boston Dynamics robots for e-commerce,"Sep 21, 2023"
The AirPods Pro 2 get even better with USB-C and excellent Adaptive Audio,"Sep 25, 2023"
"I just bought the $1,199 iPhone 15 Pro Max — here’s why","Sep 22, 2023"
Analysis: This Apple Watch feature could hint at the company's future,"Sep 20, 2023"
Apple Watch Ultra 2 vs. Apple Watch Ultra: What’s new and different?,"Sep 19, 2023"
Three things to know if you're going to upgrade to iPhone 15,"Sep 19, 2023"
iOS 17 release: See what’s new in iPhone features,"Sep 18, 2023"
iPhone 15 vs. iPhone 14: What’s new and different?,"Sep 18, 2023"
Forget Apple’s $30 USB-C to Lightning adapter — these cables are a better investment,"Sep 18, 2023"
The iPhone 15 may be the best basic iPhone yet — and you can preorder it now,"Sep 18, 2023"
The iPhone 15 is up for preorder now — here’s who should (and shouldn’t) upgrade,"Sep 15, 2023"
Wanted: Taylor Swift reporter,"Sep 15, 2023"
"The best sales to shop this weekend: Apple, Reebok, Everlane and more","Sep 15, 2023"
Apple to issue iPhone 12 update in France after sales halted over radiation levels,"Sep 15, 2023"
Should you get Apple’s iPhone Upgrade Program or use a carrier plan?,"Oct 2, 2023"
Apple Watch Series 9 and Ultra 2 preorders are live — here’s what you need to know,"Sep 14, 2023"
The iPhone 15 Pro is up for preorder right now — and we tried it early,"Sep 15, 2023"
France orders Apple to pull iPhone 12 off shelves for high radiation levels,"Sep 13, 2023"
Here’s why Apple’s charger switch is such a big deal,"Sep 13, 2023"
Apple Watch Series 9 vs. Apple Watch Series 8: Should you upgrade?,"Sep 18, 2023"
Here's one unique feature you haven't been able to do with iPhones before,"Sep 13, 2023"
"Apple unveils new iPhone, watch at event","Sep 13, 2023"
6 takeaways from Apple’s iPhone 15 event,"Sep 13, 2023"
What to expect from Apple’s iPhone 15 reveal,"Sep 13, 2023"
Opinion: Apple’s secret sauce,"Sep 13, 2023"
Apple unveils new iPhone lineup,"Sep 13, 2023"
Apple just killed the iPhone Lightning connector. What to do with your old chargers,"Sep 12, 2023"
A look back at every iPhone ever,"Sep 11, 2023"
Apple could be about to make the biggest change to the iPhone in 11 years,"Sep 8, 2023"
Apple lost $200 billion in two days after reports of iPhone ban in China,"Sep 7, 2023"
Feeling nostalgic? Take a look at the excitement over Apple's first iPhone,"Sep 7, 2023"
Nomad just dropped this gorgeous 3-in-1 charger for Apple users,"Sep 6, 2023"
"Arm’s IPO could value the chip company at $52 billion. Apple, Google and Nvidia show interest","Sep 5, 2023"
Presale tickets for Eras Tour movie break sales records,"Sep 4, 2023"
Apple expected to unveil new iPhone at ‘Wonderlust’ special event,"Aug 30, 2023"
"Get the Logitech K380, our favorite budget keyboard, at an all-time low price right now","Aug 28, 2023"
Microsoft submits new Activision deal to UK watchdog,"Aug 22, 2023"
"Arm’s mega IPO could be just around the corner, a year after the biggest chip deal in history fell apart","Aug 22, 2023"
iPhone 15 could have faster charging,"Aug 20, 2023"
Taylor Swift could break $2 billion for 'Eras' tour,"Aug 18, 2023"
Nigerian music producer uses AI to create Afrobeats,"Aug 18, 2023"
"The best sales to shop today: Apple, Reformation, Nira and more","Aug 17, 2023"
Jay-Z-themed library cards at Brooklyn Public Library,"Aug 16, 2023"
‘A real stroke of genius.’ How Apple’s iMac G3 became an object of desire,"Aug 15, 2023"
4 years later and the AirPods 2 are still as great as we remember,"Aug 14, 2023"
"Despite skipping much of the Iowa State Fair, Trump was still the main attraction","Aug 13, 2023"
The next evolution in tech needs to be nearly frozen to operate. See how it works,"Aug 13, 2023"
England beats Colombia 2-1 to reach semifinals as Australia makes history,"Aug 12, 2023"
"Sweden withstands late Japan comeback, 2-1, to make semifinals","Aug 11, 2023"
"The best sales to shop today: Lululemon, OtterBox, AeroGarden and more","Aug 9, 2023"
Justice Kagan order: Apple doesn’t have to change app store terms while battling Epic in court,"Aug 9, 2023"
"The 10 best Amazon deals to shop this week: Sharpie, Ninja, Sony and more","Aug 9, 2023"
iPhone users will soon have to adjust to this small but significant change,"Aug 9, 2023"
"The best sales to shop today: Dyson, Philips Hue, Instant Pot and more","Aug 9, 2023"
Apple’s M1 iPad Pros are massively discounted today at Woot!,"Aug 8, 2023"
Cities court Taylor Swift for Eras Tour shows,"Aug 7, 2023"
Watch Taylor Swift's moment with Kobe Bryant's daughter during show,"Aug 5, 2023"
"The best sales to shop today: Paravel, Lovesac, AirTag and more","Aug 4, 2023"
Two tech giants have contrasting earnings,"Aug 4, 2023"
Apple’s sales fall for the third consecutive quarter,"Aug 4, 2023"
"Taylor Swift Gives $100,000 Bonuses to Eras Tour Truckers","Aug 3, 2023"
"Save on MacBooks, iPads and more with these back-to-school Apple deals","Aug 1, 2023"
iOS 17 tips and tricks: Quality of life improvements and FaceTime fun,"Jul 28, 2023"
"AI ushering in a 'profound change in our relationship to machines,' says tech pioneer","Jul 27, 2023"
"The best budget phones in 2024, tried and tested","Jan 10, 2024"
Our brave new AI working world,"Jul 27, 2023"
Our brave new AI working world,"Jul 27, 2023"
"""Ultra-rare"" Apple sneakers on sale for $50,000","Jul 27, 2023"
"The 10 best Amazon deals to shop this week: Adidas, Ninja, Crocs and more","Jul 26, 2023"
"‘Ultra-rare’ Apple sneakers on sale for $50,000","Jul 26, 2023"
"Microsoft, Google and Snap report earnings","Jul 26, 2023"
Apple faces $1 billion UK lawsuit by app developers over App Store fees,"Jul 25, 2023"
July 30 Tokyo 2020 Olympics news and results,"Dec 3, 2023"
Harry and Meghan interview fallout,"Dec 3, 2023"
5 things the AirPods Pro do better than any other wireless earbuds,"Jul 20, 2023"
Amazon will let you pay with a wave of your hand at all Whole Foods stores,"Jul 20, 2023"
Apple’s macOS Sonoma brings big changes to Mac — but should you install now or wait?,"Jul 18, 2023"
Amazon and Apple fined $218 million by Spain antitrust watchdog,"Jul 18, 2023"
"‘Elusive’ Apple iPhone from 2007 sells for $190,000","Jul 18, 2023"
"Original Apple iPhone sells for more than $190,000","Aug 9, 2023"
Now Streaming: 'Foundation' season 2,"Jul 18, 2023"
Fairphone urges industry action on DIY smartphone repairs,"Jul 17, 2023"
Al Ain Adventure Park: Wild water sports out in the desert (photos),"Jul 17, 2023"
The 2020 MacBook Air is down to the lowest price we’ve seen during Prime Day,"Jul 14, 2023"
iOS 17 preview: We tried the biggest new features coming to your iPhone,"Jul 14, 2023"
New developments in the AI world,"Jul 14, 2023"
Otter Chaos: The sea otter stealing surfboards,"Jul 13, 2023"
The best Lightning Deals of Amazon Prime Day 2023,"Jul 13, 2023"
Sea otter wrestles surfboard away from its rider,"Jul 13, 2023"
We found the 193 best Amazon deals to shop before Prime Day 2023 is over,"Jul 13, 2023"
Elon Musk launches new AI company,"Jul 13, 2023"
The best laptop deals to shop during Amazon Prime Day,"Jul 12, 2023"
The 32 best Apple deals to get on Amazon Prime Day before they’re gone,"Jul 12, 2023"
These are the best iPhone deals on Amazon Prime Day 2023,"Jul 12, 2023"
The 2020 MacBook Air is down to the lowest price we’ve seen during Prime Day,"Jul 12, 2023"
The 10 best iPad deals to upgrade your tablet game for Amazon Prime Day 2023,"Jul 12, 2023"
We found the 151 best Amazon deals to shop during Prime Day 2023,"Jul 12, 2023"
"The 33 best tech deals from Amazon Prime Day 2023, from Samsung and Sony to Apple and Bose","Jul 11, 2023"
These are the best iPhone deals on Amazon Prime Day 2023,"Jul 11, 2023"
The 21 best Apple deals you can shop on Amazon Prime Day,"Jul 11, 2023"
The best laptop deals to shop during Amazon Prime Day,"Jul 11, 2023"
The best AirPod deals to shop this Amazon Prime Day 2023,"Jul 11, 2023"
The 10 best iPad deals to upgrade your tablet game for Amazon Prime Day 2023,"Jul 11, 2023"
Hollywood Minute: Taylor Swift's 'new' album,"Jul 8, 2023"
Apple Watch SE vs. Series 7: Which model is right for you?,"Jul 7, 2023"
Taylor Swift's album 'Speak Now (Taylor's Version)' is here,"Jul 7, 2023"
Nomad’s new Apple Watch band is perfect for summer — but you should act fast,"Jul 6, 2023"
The most delicious Turkish dishes,"Jul 5, 2023"
The new Mac Studio is one of the fastest computers ever — but do you really need all that power?,"Jul 3, 2023"
Apple's market cap reaches record $3 trillion,"Jul 1, 2023"
"Apple is now worth $3 trillion, boosted by the Nasdaq’s best start in 40 years","Jun 30, 2023"
"AI needs 'a new era of law and regulation,' says Microsoft president","Jun 29, 2023"
"AI needs 'a new era of law and regulation,' says Microsoft president","Jun 29, 2023"
"The 10 best Amazon deals to shop this week: Thermacell, Apple, Dyson and more","Jun 28, 2023"
"The best sales to shop today: Waterpik, Ninja, Philips Hue and more","Jun 27, 2023"
"This smartphone folds in half. It's also $1,800. We tried out Google's new phone","Jun 26, 2023"
The 15-inch MacBook Air is a superb big-screen laptop that’s still super portable,"Jun 26, 2023"
Apple Vision Pro vs. Meta Quest Pro: Which headset is right for you?,"Jun 26, 2023"
AirTag vs. Tile: Here’s how to pick the right tracker for you,"Jun 23, 2023"
iPhone 14 vs. iPhone 13: Which one is right for you?,"Jun 23, 2023"
Forget the M2 MacBook Pro — here’s why the M2 MacBook Air is a far better value,"Jun 23, 2023"
Buying a used Mac? Here’s everything you need to know,"Jun 23, 2023"
Satisfying your sweet tooth is about to get more expensive,"Jun 22, 2023"
"The best sales to shop today: iPad, Eero, Scrub Daddy and more","Jun 21, 2023"
"Spotify executive: Harry and Meghan are ""grifters""","Jun 20, 2023"
The Google Pixel Tablet is a great slate that doubles as a smart display,"Jun 20, 2023"
Recycling laptops for better education,"Jun 16, 2023"
Eco-conscious airlines around the world,"Jun 16, 2023"
"The 10 best Amazon deals to shop this week: Sony, LifeStraw, Ninja and more","Jun 15, 2023"
The Technics EAH-AZ60M2 are strong ANC earbuds — but do they beat Apple and Sony?,"Jun 14, 2023"
"The best sales to shop today: Stanley, Sonos, Bissell and more","Jun 14, 2023"
Amazon is trying to make it simpler to sift through thousands of user reviews,"Jun 13, 2023"
MacBook Air 15-inch vs. MacBook Air 13-inch: Which Apple laptop is right for you?,"Jun 13, 2023"
Tim Cook bets his legacy on augmented reality,"Jun 13, 2023"
In pictures: Apple CEO Tim Cook,"Jun 13, 2023"
BTS celebrates 10 year anniversary,"Jun 13, 2023"
Apple is determined to make headsets cool,"Jun 10, 2023"
Mark Zuckerberg has thoughts on Apple’s new mixed reality headset,"Jun 9, 2023"
Opinion: How Apple’s Vision Pro could change the world,"Jun 9, 2023"
Prince Harry finishes testifying in UK phone hacking case,"Jun 8, 2023"
Prince Harry back in court to give evidence in phone hacking case,"Jun 7, 2023"
The rivalry between Meta and Apple is moving to a new playing field: virtual reality,"Jun 7, 2023"
Why Prince Harry went to court,"Jun 6, 2023"
Prince Harry hits back against UK tabloids,"Jun 6, 2023"
I tried Apple’s new headset. Here’s what it’s like to use,"Jun 6, 2023"
"Apple unveils $3,500 mixed-reality headset","Jun 6, 2023"
Prince Harry gives evidence in London phone hacking case,"Jun 6, 2023"
"The best sales to shop today: Brooklinen, Philips Hue, Apple and more","Jun 6, 2023"
"We saw Apple’s Vision Pro up close — who is this $3,500 headset for?","Jun 6, 2023"
"Apple unveils new mixed reality headset for $3,500","Jun 6, 2023"
Apple's autocorrect tweak,"Jun 6, 2023"
Live updates: Apple unveils new products at WWDC 2023 event,"Jun 5, 2023"
The new 15-inch MacBook Air is up for preorder now — and we tried it,"Jun 5, 2023"
"Video: See Apple's new $3,499 mixed reality headset","Jun 6, 2023"
5 takeaways from Apple’s biggest product event in years,"Jun 5, 2023"
Apple unveils mixed reality headset,"Jun 5, 2023"
This could be Apple’s biggest product launch since the Apple Watch,"Jun 5, 2023"
Who owns content generated by AI?,"Jun 5, 2023"
"Our favorite product releases this week: Barbie, OtterBox and Our Place","Jun 2, 2023"
"The best sales to shop this weekend: Truff, Sonos, Apple and more","Jun 2, 2023"
Apple may soon show off its biggest and riskiest new hardware product in years,"Jun 2, 2023"
FDA finalizes limit on how much arsenic can be in apple juice,"Jun 2, 2023"
"The best sales to shop today: Lululemon, Dyson, Scrub Daddy and more","Jun 1, 2023"
The latest ultra-powerful Apple iPad Pro tablet is on sale right now,"Jun 1, 2023"
The AirPods Pro 2 are the new gold standard for Apple earbuds,"May 31, 2023"
Here are the best deals on Apple products for Memorial Day,"May 29, 2023"
Wedbush Securities sees an $800 billion market opportunity in tech companies,"May 26, 2023"
The Londoner Macao resort,"May 25, 2023"
Jeff Bezos and Lauren Sanchez get engaged,"May 23, 2023"
Apple announces multibillion-dollar agreement for 5G components made in US,"May 23, 2023"
Why Tokyo is the city of 'contradictions',"May 23, 2023"
Enjoy Tokyo like the locals do,"May 23, 2023"
Chasing the perfect blossom,"May 23, 2023"
One Taylor Swift fan found a different way to get into her concert. See how,"May 22, 2023"
"Everyone wants a foldable phone, but most of us can’t afford one yet","May 21, 2023"
New York City is sinking as sea levels rise,"May 20, 2023"
Apple got rich in China. Other Asian markets offer the next ‘golden opportunity’,"May 20, 2023"
Photos show children of immigrants stepping into their parents’ shoes,"May 19, 2023"
Apple’s $19 EarPods are hot again — here’s what it’s like to actually use them,"May 18, 2023"
The fastest charger for your iPhone 13,"May 18, 2023"
"The 10 best Amazon deals to shop this week: Stanley, MacBook, Olay and more","May 18, 2023"
'Insatiable': Royal commentator on what Harry and Meghan chase reveals,"May 18, 2023"
Analyst breaks down what happened during Harry and Meghan's alleged car chase,"May 17, 2023"
Photos of the ‘Mother’s Market’ in India,"May 17, 2023"
Your iPhone will soon be able to replicate your voice after 15 minutes of training,"May 16, 2023"
"The best sales to shop today: Nike, Mac Mini, Philips Hue and more","May 16, 2023"
"Smartphone history film, 'BlackBerry'","May 16, 2023"
A 4-pack of Apple AirTags is on sale right now,"May 16, 2023"
"The best sales to shop today: Apple, Zappos, Cabeau and more","May 15, 2023"
The excellent MacBook Air M2 is back to its lowest-ever price on Amazon,"May 15, 2023"
Hear Reddit co-founder's response when asked if Government is equipped to regulate AI,"May 13, 2023"
AI investor explains how this new technology could revolutionize how we watch television,"May 11, 2023"
"A foldable phone, new tablet and lots of AI: What Google unveiled at its big developer event","May 11, 2023"
"We got a sneak peek at the Google Pixel Tablet, up for preorder now","May 11, 2023"
"The 10 best Amazon deals to shop this week: Anker, Mario Badescu, Tramontina and more","May 10, 2023"
Artificial intelligence and the future of work,"May 9, 2023"
"The best sales to shop today: Logitech, Therabody, HigherDose and more","May 9, 2023"
Incredible railway experiences around the world,"May 8, 2023"
Hear how Ed Sheeran describes his friendship with Taylor Swift,"May 5, 2023"
"Highlights of Nagoya, Japan","May 5, 2023"
Apple posts second consecutive quarterly revenue decline,"May 5, 2023"
Our favorite 2-in-1 laptop combines portability and capability at an all-time low price,"May 4, 2023"
"The 10 best Amazon deals to shop this week: Apple, Cuisinart, OtterBox and more","May 4, 2023"
The best walking trails that explore the flora and fauna of South Africa (photos),"May 3, 2023"
Apple and Google are teaming up on a plan to make Bluetooth trackers like AirTags safer,"May 3, 2023"
