Apple’s iMac M3 is the perfect home office upgrade at this all-time low price,"Mar 29, 2024"
"The best sales to shop today: Drunk Elephant, Apple, Macy’s and more","Mar 28, 2024"
Behind the remarkable rise of the Savannah Bananas,"Mar 28, 2024"
The pricey Apple Vision Pro just got its first-ever discount,"Mar 28, 2024"
The MacBook Pro M3 just hit its lowest price ever — get it while you can,"Mar 28, 2024"
A 4-pack of Apple’s beloved AirTags is back down to its lowest price,"Mar 28, 2024"
The excellent new MacBook Air M3 is already $100 off right now,"Mar 27, 2024"
Apple announces its annual developers conference is set for June 10,"Mar 26, 2024"
Galloway: EU is taking a tougher stance on tech than the U.S.,"Mar 26, 2024"
3 ways Apple’s monopoly lawsuit could change the iPhone experience for fans,"Mar 26, 2024"
Shohei Ohtani says he never gambled on sports,"Mar 26, 2024"
It’s your last chance to shop the 165 best Prime Day-level deals from Amazon’s Big Spring Sale,"Mar 25, 2024"
It’s your last day to save on the 35 best tech deals from Amazon’s Prime Day-like Big Spring Sale,"Mar 25, 2024"
"Apple, Google and Meta at risk of ‘heavy’ fines as Europe launches new probes","Mar 25, 2024"
We found the 189 best Prime Day-level deals from Amazon’s Big Spring Sale,"Mar 24, 2024"
We found the 35 best tech deals from Amazon’s Prime Day-like Big Spring Sale,"Mar 24, 2024"
We found the 35 best tech deals from Amazon’s Prime Day-like Big Spring Sale,"Mar 23, 2024"
We found the 189 best Prime Day-level deals from Amazon’s Big Spring Sale,"Mar 23, 2024"
These two phrases in Harry and Meghan's statement stood out to royal analyst,"Mar 23, 2024"
Apple co-founder calls out 'hypocrisy' of politicians calling for TikTok ban,"Mar 23, 2024"
We found the 189 best Prime Day-level deals from Amazon’s Big Spring Sale,"Mar 22, 2024"
We found the 35 best tech deals from Amazon’s Prime Day-like Big Spring Sale,"Mar 22, 2024"
Master your Apple Vision Pro with these 11 tips and tricks,"Mar 22, 2024"
Apple customers love Apple. The Biden administration thinks they could do better,"Mar 22, 2024"
"Breton: The EU is not anti-tech, it just has rules","Mar 22, 2024"
We found the 174 best Prime Day-level deals from Amazon’s Big Spring Sale,"Mar 22, 2024"
Apple faces antitrust suit alleging monopoly,"Mar 22, 2024"
US sues Apple in antitrust lawsuit,"Mar 21, 2024"
We found the 30 best tech deals from Amazon’s Prime Day-like Big Spring Sale,"Mar 21, 2024"
"Green bubbles, Apple Pay and other reasons why America says Apple is breaking the law","Mar 21, 2024"
The AirPods Pro 2 are down to a new all-time low price for Amazon’s Big Spring Sale,"Mar 21, 2024"
Attorney general outlines antitrust lawsuit against Apple,"Mar 21, 2024"
Apple sued in a landmark iPhone monopoly lawsuit,"Mar 21, 2024"
AI fever grips World Economic Forum,"Mar 21, 2024"
Tim Cook is on a charm offensive in China to revive flagging iPhone sales,"Mar 21, 2024"
We found the 150 best Prime Day-level deals from Amazon’s Big Spring Sale,"Mar 21, 2024"
"Meta, Microsoft, X and Match Group challenge Apple over app store terms","Mar 20, 2024"
Why you should think twice before buying a new phone,"Mar 20, 2024"
Ohtani makes Dodgers debut as Major League Baseball goes global,"Mar 20, 2024"
CNN projects Trump-endorsed Moreno wins key Ohio GOP Senate primary,"Mar 20, 2024"
Apple is getting serious about AI,"Mar 19, 2024"
Microsoft president makes big bet on Europe with AI investments,"Mar 18, 2024"
This Tokyo rice ball restaurant is grounded in family tradition,"Mar 16, 2024"
Apple’s M1 MacBook Air is down to a new all-time low price,"Mar 15, 2024"
McDonald's locations around the world experience I.T. failure,"Mar 15, 2024"
The amazing MacBook Air M1 is now just $699 at Walmart — how to get yours,"Mar 15, 2024"
This Tokyo 'masterpiece café' is a step back in time for classical music lovers,"Mar 15, 2024"
‘Apples Never Fall’ grows from the twisty roots of a Liane Moriarty mystery,"Mar 14, 2024"
How technology can help feed the planet,"Mar 14, 2024"
House passes bill that could lead to US ban of TikTok,"Mar 14, 2024"
Christina Applegate believes she was living with MS for years before she was diagnosed,"Mar 13, 2024"
A photo tour of Qatar’s Resort Al Barari desert camp,"Mar 11, 2024"
'Apples Never Fall' reveals cracks in a 'perfect' family,"Mar 11, 2024"
Report: iPhone sales down 24% in China to start the year,"Mar 10, 2024"
Our favorite iPad is back down to its all-time low price right now,"Mar 8, 2024"
Apple backs down on EU ban for ‘Fortnite’-maker Epic Games,"Mar 8, 2024"
Are Apple’s new MacBook Air M3 laptops worth it? I’ve tested them to find out,"Mar 8, 2024"
"The best sales to shop this weekend: Kitsch, Apple, Sony and more","Mar 8, 2024"
U.S. legislation targets one of the most popular social media apps,"Mar 8, 2024"
UN World Restoration Flagships 2024,"Mar 7, 2024"
"Big changes for Apple, Google and other tech giants: Europe’s sweeping law goes into effect today","Mar 7, 2024"
OpenAI publishes Musk's emails to refute lawsuit claims,"Mar 7, 2024"
Applebee’s is shrinking. Its parent company may open joint restaurants with IHOP,"Mar 7, 2024"
"The 10 best Amazon deals to shop this week: Bose, Crocs and Neutrogena","Mar 6, 2024"
Sustainable airports around the world,"Mar 6, 2024"
Apple iPhones sales fall 24% in China amid competition and headwinds,"Mar 5, 2024"
Editors’ Picks: The 48 best products we tried and loved in February,"Mar 5, 2024"
Singapore defends paying Taylor Swift to not perform in neighboring countries,"Mar 5, 2024"
Apple just announced the M3 MacBook Air — how to preorder now,"Mar 4, 2024"
Apple hit with landmark $2 billion EU antitrust fine,"Mar 4, 2024"
In pictures: NBA great LeBron James,"Mar 3, 2024"
'I can't believe it was me': Rex Chapman on stealing from Apple store,"Mar 2, 2024"
'I can't believe it was me': Rex Chapman on stealing from Apple store,"Mar 2, 2024"
Hear what surprises reporter about Oprah's departure from WeightWatchers,"Mar 1, 2024"
Apple reportedly abandons its electric car project as EV makers struggle,"Feb 29, 2024"
"The 10 best Amazon deals to shop this week: Apple, Bissell and Levoit","Feb 28, 2024"
Prince Harry loses legal dispute over personal security,"Feb 28, 2024"
"Apple cancels work on an electric car, reports say","Feb 28, 2024"
Our favorite Logitech computer mouse is down to a new all-time low price,"Feb 27, 2024"
"The best sales to shop today: Fellow Stagg, iRobot, Logitech and more","Feb 27, 2024"
Is the pricey Apple Vision Pro worth it? I spent 2 weeks using one to find out,"Feb 27, 2024"
You may lose access to your Netflix account if you’re paying through Apple,"Feb 27, 2024"
"The best sales to shop today: Apple, Hoover, Xbox and more","Feb 26, 2024"
See Taylor Swift's heartwarming surprise for 9-year-old with brain cancer,"Feb 26, 2024"
The world is obsessed with soccer. Can Apple make Americans love it too?,"Feb 24, 2024"
"Tiny tablet, big discount: Get the Apple iPad Mini for 20% off right now","Feb 23, 2024"
In pictures: Oman Cultural Complex,"Feb 23, 2024"
Watch: Tesla Cybertruck reviews from both Elon Musk fans and haters,"Feb 22, 2024"
Travis Kelce lands in Australia to support Taylor Swift at her Eras Tour,"Feb 22, 2024"
"The 10 best Amazon deals to shop this week: Apple, Ninja and Anker","Feb 21, 2024"
Apple launches its first sports app,"Feb 21, 2024"
"Ewen MacIntosh, star of British comedy ‘The Office,’ dead at 50","Feb 21, 2024"
Uber Eats is launching robot deliveries in Japan,"Feb 21, 2024"
"The best sales to shop today: Great Jones, Logitech, LG and more","Feb 20, 2024"
Judge orders Trump and companies to pay nearly $355 million in civil fraud trial,"Feb 17, 2024"
Warren Buffett’s Berkshire Hathaway sells off some Apple stock,"Feb 15, 2024"
Mark Zuckerberg reviewed Apple’s Vision Pro headset. Here’s what he had to say about how it compares to Meta’s Quest 3,"Feb 14, 2024"
"Can’t spend $3,500 on Apple Vision Pro? Try these 3 great headsets instead","Feb 13, 2024"
VIDEO: Peek inside Harvard's class on Taylor Swift,"Feb 13, 2024"
You almost never saw the most famous Super Bowl ad of all time,"Feb 12, 2024"
"The best Apple headphones in 2024, tried and tested","Feb 28, 2024"
Taylor Swift performing in Tokyo before flying to Las Vegas for Super Bowl,"Feb 10, 2024"
Apple TV 4K vs. Roku Ultra: Which streaming box is right for you?,"Feb 8, 2024"
Taylor Swift's Eras Tour concert film will start streaming next month on Disney+,"Feb 8, 2024"
Hollywood Minute: Taylor Swift to sue jet tracker?,"Feb 7, 2024"
"The 10 best Amazon deals to shop this week: Apple, Bose and Neutrogena","Feb 7, 2024"
Taylor Swift continues record-breaking tour in Tokyo,"Feb 7, 2024"
"Taylor Swift mania sweeps Tokyo for sold-out concerts, with all eyes on return trip to Super Bowl","Feb 8, 2024"
A magical trip to Scotland helped a grieving father start to heal,"Feb 7, 2024"
AppleCare explained: What you need to know about Apple’s warranty program,"Feb 6, 2024"
"The best sales to shop today: Hoka, Dyson, Samsung and more","Feb 6, 2024"
"Naomi Osaka: ""I'm a lot more serious now""","Feb 5, 2024"
"The best sales to shop today: Apple, Breville, Yeti and more","Feb 5, 2024"
Watch Taylor Swift make Grammy history and surprise fans with announcement,"Feb 5, 2024"
Smerconish: Does Taylor Swift have the power to sway the election?,"Feb 3, 2024"
The 9 best Apple Vision Pro accessories to check out for your new headset,"Feb 2, 2024"
Apple’s Vision Pro headset hits US stores today. Here’s what you need to know,"Feb 2, 2024"
"Apple's new headset just dropped: Will you pay $3,500?","Feb 2, 2024"
Rockstar reveals her worry about Swift-Kelce relationship,"Feb 2, 2024"
"Apple sales boost profits, but China struggles continue","Feb 2, 2024"
"I just tried Apple Vision Pro — here’s what I think of this $3,500 headset so far","Feb 1, 2024"
"Save $300 on our favorite laptop, the MacBook Air M2, right now","Feb 1, 2024"
"The best sales to shop today: Ember, Nintendo, Apple and more","Feb 1, 2024"
Travis Kelce thanks Taylor Swift ‘for joining the team’,"Feb 1, 2024"
Stopping non-consensual AI porn is almost impossible. Here's why,"Feb 1, 2024"
Would Swift return from Tokyo show in time to watch Kelce play in Super Bowl? CNN reporter does the math,"Jan 29, 2024"
Peru's Amazon rainforest treehouse classroom,"Jan 29, 2024"
On GPS: Bill Gates on how AI can save millions of lives,"Jan 28, 2024"
Restaurant offered subscriptions for date nights. It sold out in 60 seconds,"Jan 28, 2024"
"Explicit, AI-generated Taylor Swift images spread online","Jan 26, 2024"
"Celebs, scientists and sports stars give their tips for Saudi Arabia","Jan 26, 2024"
The iPhone 15 is a surprisingly big upgrade — and the best option for most,"Jan 26, 2024"
The best Apple Watch bands designed for working out in 2024,"Jan 26, 2024"
"Apple announces sweeping changes for apps in Europe, including allowing third-party app stores for the first time","Jan 25, 2024"
"The best sales to shop today: Apple, Samsung, Hydro Flask and more","Jan 25, 2024"
5 huge challenges facing Apple this year,"Jan 25, 2024"
"The best sales to shop today: Hoover, Gaiam, Patagonia and more","Jan 24, 2024"
Apple security update to safeguard against thieves now available,"Jan 22, 2024"
Swift-inspired menu served at Buffalo Bills game,"Jan 22, 2024"
Photos: This US couple bought a home in Italy’s Molise region,"Jan 22, 2024"
Applebee's is selling a subscription pass for your date nights,"Jan 20, 2024"
Applebee’s is offering a subscription pass for your date nights,"Jan 20, 2024"
"The best sales to shop this weekend: Athleta, Bose, Apple and more","Jan 19, 2024"
The Apple Vision Pro headset is finally available for preorder — how to get your own,"Jan 19, 2024"
The week in 36 photos,"Jan 19, 2024"
Where to buy the original Apple Watch Series 9 and Ultra 2 with all the features,"Jan 18, 2024"
Apple Watch imports banned in America - again,"Jan 18, 2024"
"The best sales to shop today: Apple Watch, Aerogarden, Hydrow and more","Jan 17, 2024"
What Christina Applegate has said about living with multiple sclerosis,"Jan 17, 2024"
The latest on the Iowa caucuses and 2024 primary campaign,"Jan 17, 2024"
Apple risks a hit to its sales after Supreme Court declines to review Epic’s app store case,"Jan 16, 2024"
Harvard professor on Trump's big win in Iowa,"Jan 16, 2024"
Apple is offering rare iPhone discounts in China,"Jan 15, 2024"
Apple has an approved fix to get around the Watch ban. Customers may not like it,"Jan 15, 2024"
"See the X-59, NASA’s new supersonic concept plane","Jan 15, 2024"
How Naomi Osaka Became More Than Just A Tennis Star,"Jan 14, 2024"
Move over Apple: Microsoft is now the most valuable publicly traded company,"Jan 13, 2024"
"Apple knew AirDrop users could be identified and tracked as early as 2019, researchers say","Jan 12, 2024"
South Korea’s pet cafes,"Jan 12, 2024"
Al Gore is officially too old to serve on Apple’s board,"Jan 11, 2024"
We’ve tested every iPhone — here are the best ones,"Jan 11, 2024"
"The best sales to shop today: Bissell, Samsung, AirTags and more","Jan 11, 2024"
This $139 iPhone case gives you a real keyboard to type on — and we tried it,"Jan 10, 2024"
McDonald’s is bringing back a fan favorite after four years,"Jan 10, 2024"
The world’s most powerful passports of 2024,"Jan 10, 2024"
The best smartphones in 2024,"Jan 9, 2024"
"The best MacBook in 2024, tried and tested","Jan 9, 2024"
This US couple bought a 400-year-old Italian tower,"Jan 9, 2024"
Tropicana is one company that’s ditching AI,"Jan 9, 2024"
This ship is following Charles Darwin’s voyage around the world,"Jan 9, 2024"
Apple faces epochal moment with looming antitrust scrutiny,"Jan 8, 2024"
Apple announces when the Vision Pro will go on sale,"Jan 8, 2024"
'It's very unusual': CNN reporter unpacks controversy around NYT and Taylor Swift,"Jan 6, 2024"
The Nomad Stand One Max is a great luxury Apple charger with one big flaw,"Jan 5, 2024"
The week in 34 photos,"Jan 5, 2024"
These great iPhone 15 cases will protect and personalize your new phone,"Jan 4, 2024"
This Japanese startup is expanding with the e-scooter market,"Jan 4, 2024"
The most on-time airports and airlines,"Jan 4, 2024"
This jewelry is made from the silver found in X-ray films,"Jan 3, 2024"
Japan Airlines jet burst into flames after collision with quake-relief plane,"Jan 3, 2024"
"Apple shares slide following Barclays downgrade, dragging down markets","Jan 2, 2024"
"The best sales to shop today: Bissell, Laneige, iPad and more","Jan 2, 2024"
The iPhone 15 accessories I can’t stop using,"Jan 2, 2024"
Andy Cohen on why his son tells people Santa doesn't come to their house,"Jan 1, 2024"
How AI will be impacted by the New York Times' landmark lawsuit,"Dec 30, 2023"
"The 10 best Amazon deals to shop this week: Apple, Hatch, Lego and more","Dec 28, 2023"
Apple to resume U.S. sales of its newest watch,"Dec 28, 2023"
Here’s when Apple Watches are set to return to store shelves,"Dec 28, 2023"
"From sold-out tours to box office success, 2023 was the Year of Taylor Swift","Dec 28, 2023"
Apple to restart watch sales after court temporarily blocks import ban,"Dec 27, 2023"
Where you can still buy the latest Apple Watch,"Dec 27, 2023"
Apple is no longer selling the newest Apple Watch in America after the White House declines to overturn ban,"Dec 27, 2023"
Apple files appeal to overturn ban on some Apple Watch models,"Dec 26, 2023"
Our tech editors’ 11 favorite gadgets of 2023,"Dec 26, 2023"
Today is the last day for Joe Biden to keep the Apple Watch on shelves,"Dec 26, 2023"
Survey: 77% of Americans choose fake Christmas tree,"Dec 23, 2023"
Jabra Elite 10 vs. Apple AirPods Pro 2: Which earbuds are best for you?,"Dec 22, 2023"
Azerbijan carpets in photos,"Dec 22, 2023"
The world’s busiest flight routes 2023,"Dec 22, 2023"
Bullet train extension offers quick access to Japan’s Hokuriku region,"Dec 22, 2023"
"Autonomous vehicles are taking to our skies, seas and streets","Dec 21, 2023"
U.S. lawmakers seek to block Japanese purchase of U.S. Steel,"Dec 21, 2023"
"The 10 best Amazon deals to shop this week: Beats, Brita, Waterpik and more","Dec 20, 2023"
Get all the upgrades of the Apple Watch Ultra for less with this deal on a refurbished model,"Dec 19, 2023"
Save 20% on the M1-powered iPad Air with this deal from Best Buy,"Dec 19, 2023"
Cyber Monday 2023 is almost over — get the best Best Buy deals while you still can,"Nov 27, 2023"
"The MacBook Pro M3 is super fast, pretty pricey and thrilling in Space Black","Dec 19, 2023"
4 things to know about the Apple Watch fiasco,"Dec 19, 2023"
In pictures: The history of US Steel,"Dec 19, 2023"
Apple to halt sales of some Apple Watches in US,"Dec 19, 2023"
Foxconn makes most of the world’s iPhones. Now its CEO wants to make EVs,"Dec 18, 2023"
What happened to the 13 stranded strangers who went on a road trip,"Dec 16, 2023"
I spent one month with the 16-inch M3 Max MacBook Pro — here’s what I think,"Dec 15, 2023"
"The best sales to shop this weekend: Apple, Murad, Logitech and more","Dec 15, 2023"
The powerful Apple Watch Ultra 2 is on sale for its lowest price yet,"Dec 13, 2023"
Taylor Swift named Time's 2023 'Person of the Year',"Dec 13, 2023"
Apple unveils new security feature to safeguard against thieves,"Dec 13, 2023"
"Get an all-time low price on the Google Pixel 7 Pro, an Android phone we love","Dec 13, 2023"
"The 10 best Amazon deals to shop this week: Apple, Bissell, Cuisinart and more","Dec 13, 2023"
"The best sales to shop today: iPad, Reformation, Outdoor Voices and more","Dec 13, 2023"
This chef ditched Tokyo life to be closer to his ingredients,"Dec 12, 2023"
The world’s top city destinations for 2023,"Dec 12, 2023"
Shohei Ohtani agrees to historic deal with L.A. Dodgers,"Dec 10, 2023"
Chris Wallace told to give back Taylor Swift bracelet after criticism of 'Time' honor,"Dec 9, 2023"
"Our favorite product releases this week: Samsonite x Boss, Bearaby, ThirdLove","Dec 8, 2023"
Save on Apple AirTags ahead of holiday travel with this deal,"Dec 18, 2023"
"The best sales to shop this weekend: Theragun, Chewy, Stasher and more","Dec 8, 2023"
Photos: Alphonse Island in the Seychelles,"Dec 8, 2023"
‘Headquarters of the future’: Plans for Chinese tech firm Tencent’s vast new campus unveiled,"Dec 7, 2023"
Pictures: European towns and cities that look like Christmas,"Dec 6, 2023"
Krill Design creates furniture from food waste,"Dec 4, 2023"
Pictures: New carnival exhibition at Grenada’s underwater sculpture park,"Dec 4, 2023"
"Kyushu, home to Japan’s best sweets","Dec 1, 2023"
15 AirPods tips and tricks to help you master your earbuds,"Nov 30, 2023"
Nomad’s excellent iPhone case and Apple Watch band just got a new color,"Nov 30, 2023"
Innovations for greener transport,"Nov 30, 2023"
Pictures: The couple traveling in an Airstream with their pet goat,"Nov 29, 2023"
Here are the 130 best Amazon Cyber Monday 2023 deals you can still shop today,"Nov 28, 2023"
It’s your last chance for the best 27 Apple Cyber Monday deals of 2023,"Nov 28, 2023"
It’s your last chance to shop Target’s 40 best Cyber Monday deals,"Nov 28, 2023"
You’ve only got a few more hours to shop the 54 best Cyber Monday deals at Walmart,"Nov 28, 2023"
Woman creates stunning Taylor Swift-themed holiday display,"Nov 28, 2023"
Don’t miss your chance to shop the 256 best Cyber Monday 2023 deals at Amazon,"Nov 28, 2023"
Here are the 398 best deals to shop before Cyber Monday 2023 is over,"Nov 28, 2023"
Cyber Monday 2023 is almost over — get these 150 deals on the best products we’ve tested while you still can,"Nov 27, 2023"
Cyber Monday 2023 is almost over — get these 10 AirPod deals while you still can,"Nov 27, 2023"
Here are our editors’ favorite Cyber Monday deals to shop before it’s too late,"Nov 27, 2023"
Time’s running out on the best Cyber Monday laptop deals of 2023,"Nov 27, 2023"
Get the best iPad Cyber Monday deals of 2023 while you still can,"Nov 27, 2023"
The Xbox Series X is at an all-time low price at Amazon’s Cyber Monday sale,"Nov 27, 2023"
It’s your last chance to get the best MacBook Cyber Monday deals of 2023,"Nov 27, 2023"
We found the 15 best Xbox deals to get before Cyber Monday 2023 is over,"Nov 27, 2023"
This $150 discount makes the Google Pixel 8 a steal for Cyber Monday,"Nov 27, 2023"
Get the Nintendo Switch Lite and Animal Crossing game for $199 in this Cyber Monday deal,"Nov 27, 2023"
Anker’s portable 511 Nano 3 USB-C charger just got better with 20% off at Amazon,"Mar 14, 2024"
Cyber Monday is winding down — shop our tech editors’ favorite deals while they’re still around,"Nov 27, 2023"
Photos: Treeful treehouse hotel in Japan,"Nov 27, 2023"
Last chance for these Cyber Monday Apple Watch deals — including $175 off the Apple Watch 8,"Nov 27, 2023"
The 2nd-gen Apple Pencil is down to its lowest price ever for Cyber Monday,"Nov 27, 2023"
Save $250 on the capable and portable Acer Swift Go 14 laptop for Cyber Monday,"Nov 27, 2023"
Underscored readers love these products — grab them while they’re still on sale for Cyber Monday,"Nov 27, 2023"
Soneva Fushi mosquito eradication program,"Nov 27, 2023"
128 Cyber Monday sales on the best products we’ve tested,"Nov 26, 2023"
The 47 best Best Buy Cyber Monday deals in 2023,"Nov 26, 2023"
"The 2022 iPad is a superb tablet, but who is it actually for?","Nov 26, 2023"
The best Cyber Monday deals on Apple iPhone,"Nov 26, 2023"
"23 best Cyber Monday laptop deals for 2023: MacBooks, Chromebooks and more","Nov 26, 2023"
11 best iPad Cyber Monday deals for 2023,"Nov 26, 2023"
27 best Apple Cyber Monday deals for 2023,"Nov 26, 2023"
Apple AirTags are on sale at Amazon for Cyber Monday,"Nov 26, 2023"
We found the 15 best Xbox deals for Cyber Monday 2023,"Nov 26, 2023"
"The 10 best Cyber Monday 2023 electronic deals, according to our tech editors","Nov 26, 2023"
Here are the 224 best Amazon deals ahead of Cyber Monday 2023,"Nov 26, 2023"
Here are our editors’ favorite Cyber Monday deals to shop right now,"Nov 26, 2023"
Target’s 37 best Cyber Monday deals that belong in your cart now,"Nov 26, 2023"
"Underscored readers love these products — luckily, they’re on sale for Cyber Monday","Nov 26, 2023"
We found the 398 best Cyber Monday 2023 deals,"Nov 26, 2023"
Save $250 on the capable and portable Acer Swift Go 14 laptop for Cyber Monday,"Nov 26, 2023"
9 best MacBook Cyber Monday deals for 2023,"Nov 26, 2023"
11 best AirPod Cyber Monday deals for 2023,"Nov 26, 2023"
The AirPods Pro 2 are down to a new all-time low price for Cyber Monday,"Nov 26, 2023"
Shop the 43 very best Cyber Monday deals at Walmart,"Nov 26, 2023"
26 best Apple Watch deals for Cyber Monday include this rock-bottom price on the editor-favorite Apple Watch 8,"Nov 26, 2023"
Here are 205 Black Friday 2023 deals at Amazon that you can still shop today,"Nov 25, 2023"
You can still score Target Black Friday deals — here are the 40 best ones we’ve found,"Nov 25, 2023"
"Black Friday 2023 is over, but you can still shop these 390 best deals today","Nov 25, 2023"
"25 best Black Friday laptop deals still live for 2023: MacBooks, Chromebooks and more","Nov 25, 2023"
27 best Apple Black Friday deals still live for 2023,"Nov 25, 2023"
The best Black Friday 2023 deals on Apple iPhone are still available today,"Nov 25, 2023"
11 best iPad Black Friday deals still live for 2023,"Nov 25, 2023"
9 best MacBook Black Friday deals still live for 2023,"Nov 25, 2023"
Apple Watch deals are still going strong with a low price on our editor-favorite Apple Watch 8,"Nov 25, 2023"
Save $250 on the capable and portable Acer Swift Go 14 laptop for Black Friday,"Nov 25, 2023"
How iPhone maker Foxconn plans to become a global EV player,"Nov 24, 2023"
The 2nd-gen Apple Pencil is down to its lowest price ever for Black Friday,"Nov 24, 2023"
The AirPods Pro 2 are down to a new all-time low price for Black Friday,"Nov 25, 2023"
Apple AirTags are still on sale at Amazon for Black Friday,"Nov 25, 2023"
27 best Apple Black Friday deals for 2023,"Nov 23, 2023"
Here are all 177 best deals to shop at Amazon during Black Friday 2023,"Nov 23, 2023"
We found the very best Black Friday deals to shop at Walmart,"Nov 23, 2023"
We found the 30 best Target Black Friday deals you can shop today,"Nov 23, 2023"
We found all the best deals for Black Friday 2023,"Nov 23, 2023"
Why AirTags are the ultimate travel companion this holiday season,"Nov 26, 2023"
11 best iPad Black Friday deals for 2023,"Nov 23, 2023"
The 2nd-gen Apple Pencil is down to its lowest price ever for Black Friday,"Nov 23, 2023"
9 best MacBook Black Friday deals of 2023,"Nov 23, 2023"
Lowest price ever on Apple Watch 9 and other Black Friday deals 2023,"Nov 24, 2023"
Lowest price ever on Apple Watch 9 and other Black Friday deals 2023,"Nov 23, 2023"
The AirPods Pro 2 are down to a new all-time low price for Black Friday,"Nov 23, 2023"
Apple AirTags are on sale at Amazon for Black Friday,"Nov 23, 2023"
"The 11 best Black Friday 2023 electronic deals, according to our tech editors","Nov 23, 2023"
"The 11 best Black Friday 2023 electronic deals, according to our tech editors","Nov 22, 2023"
24 best Apple Black Friday deals for 2023,"Nov 22, 2023"
The AirPods Pro 2 are down to a new all-time low price for Black Friday,"Nov 22, 2023"
9 best MacBook Black Friday deals of 2023,"Nov 22, 2023"
11 best iPad Black Friday deals for 2023,"Nov 22, 2023"
October is prime apple season. Why did prices plunge?,"Nov 21, 2023"
