'The Godfather of AI' quits Google and warns of its dangers. Apple co-founder weighs in,"May 2, 2023"
"Met Gala red carpet moments, through the years","May 1, 2023"
"The best sales to shop today: KitchenAid, Chewy, Yeti and more","May 1, 2023"
The iPhone 14 is more of a good thing — but is it the right phone for you?,"May 1, 2023"
Why everyone in business loves India right now,"May 1, 2023"
Taylor Swift tour reveals some consumers willing to splurge,"Apr 30, 2023"
Take a look at the world’s first underwater farm,"Apr 27, 2023"
Live Updates: Microsoft and Google shares pop after earnings results,"Apr 26, 2023"
"Driver of SUV that crashed into a Massachusetts Apple store accelerated to 60 mph before deadly crash, prosecutor says","Apr 25, 2023"
Appeals court largely sides with Apple on ‘Fortnite’ antitrust case,"Apr 24, 2023"
The peril and the promise of AI,"Apr 24, 2023"
Harry and Meghan talk about decision to leave royal life (2021),"Apr 23, 2023"
How to protect yourself from iPhone thieves locking you out of your own device,"Apr 23, 2023"
Score an Apple Mac Mini with M2 chip at one of its lowest prices yet,"May 16, 2023"
My Drive with Toyin Abraham Ajeyemi,"Apr 21, 2023"
The music industry is on alert after AI-generated Drake song goes viral,"Apr 20, 2023"
"The best sales to shop today: iPad, Casper, GreenPan and more","Apr 20, 2023"
Americans are buying more marijuana than chocolate,"Apr 20, 2023"
Apple commits to investing across India as Tim Cook opens second store,"Apr 20, 2023"
Apple is giving banks a run for their money,"Apr 18, 2023"
Tim Cook opens first Apple store in India,"Apr 18, 2023"
Apple CEO was presented with an original Macintosh. See his reaction,"Apr 18, 2023"
Apple opening its first retail stores in India,"Apr 18, 2023"
Apple offers 4.15% high-yield savings to its Apple Card holders,"Apr 17, 2023"
In pictures: Golf icon Tiger Woods,"Apr 16, 2023"
The president of the world's first artificial intelligence university speaks to CNN about the benefits and dangers of artificial intelligence,"Apr 12, 2023"
Inside ICON: The 3D printing architecture company with out of this world ambition,"Apr 12, 2023"
"The secrets to making perfect macarons at home, according to a pastry chef","Apr 11, 2023"
"The best sales to shop today: Dyson, Logitech, Windmill and more","Apr 11, 2023"
New trains and new rail routes to travel in Japan,"Apr 11, 2023"
The best tips and tricks for iOS 16 features and the new iOS 16.4,"Apr 10, 2023"
A bunch of Apple accessories are over 50% off right now,"Apr 7, 2023"
Apple is set to open its first retail store in Mumbai as it bets big on India,"Apr 6, 2023"
Apple’s Weather app briefly went down and rained on everyone’s morning,"Apr 4, 2023"
Sazenka: Tokyo’s best high-end Chinese restaurant,"Apr 4, 2023"
"Our pick for the best budget e-reader, the Kindle Paperwhite, is $50 off today","Oct 3, 2023"
"GM plans to phase out Apple CarPlay in EVs, with Google’s help","Apr 1, 2023"
"Our favorite product releases this week: Glossier, Olaplex, Gravity and more","Mar 31, 2023"
"New airport, new experiences: Why 2023 is the year to visit Mongolia","Mar 31, 2023"
"The best sales to shop today: Apple, Bando, Coway and more","Mar 30, 2023"
2023 MLB season kicks off,"Mar 30, 2023"
"Acer’s slim, sizable Swift Edge is a steal right now at Amazon","Mar 29, 2023"
Prince Harry at London's High Court,"Mar 29, 2023"
Pepsi gets a new logo,"Mar 29, 2023"
"Apple launches buy now, pay later service","Mar 28, 2023"
Liam Garner’s incredible ride from Alaska to Argentina (Photos),"Mar 27, 2023"
"After TikTok chief’s grilling in Washington, Apple’s Tim Cook is all smiles in Beijing","Mar 25, 2023"
Abu Dhabi’s best restaurants (photos),"Mar 24, 2023"
"March 23, 2023 - TikTok CEO Shou Chew testifies before Congress","Mar 24, 2023"
Adam Sandler’s career in comedy,"Mar 23, 2023"
AI rises to 'top of the list' for tech bosses,"Mar 21, 2023"
Photos of the Pegasus superyacht concept,"Mar 21, 2023"
See how Taylor Swift surprised one super fan,"Mar 21, 2023"
"AI rises to ""top of the list"" for tech bosses","Mar 20, 2023"
A photo tour of Italy ghost village San Severino,"Mar 20, 2023"
Latest on banks and global markets,"Mar 17, 2023"
Go inside the Harry Potter Studio Tour in Tokyo,"Mar 15, 2023"
Macao reopens to tourism after Covid,"Mar 15, 2023"
"Masatoshi Ito, Japanese billionaire behind the rise of 7-Eleven, dies at 98","Mar 15, 2023"
"This chef runs a Tokyo restaurant with an outstanding reputation, but only six seats","Mar 13, 2023"
Bill Maher shares Elon Musk's next potential project. Hear the audience's immediate reaction,"Mar 11, 2023"
How pearls helped shape the future of Qatar,"Mar 9, 2023"
Apple supplier Foxconn is on the hunt for semiconductor and EV deals in India,"Mar 4, 2023"
"In Dubai, camels are being cloned for beauty pageants and races","Mar 1, 2023"
Apple supplier unlikely to resume full India operations for two months after massive fire,"Feb 28, 2023"
The reality behind aviation’s golden age,"Feb 28, 2023"
The only woman living on a former Italian prison island,"Feb 24, 2023"
"A first generation iPhone fetches $63,000 at auction","Feb 21, 2023"
New online superstore surpasses Amazon and Walmart to become most downloaded app in US,"Feb 19, 2023"
Traveling the world as a wheelchair user,"Feb 17, 2023"
Malik Afegbua’s stunning AI art,"Feb 16, 2023"
How Amsterdam’s North-South metro line unearthed hidden artifacts,"Feb 13, 2023"
The retired Boeing 737 that’s been transformed into a private villa,"Feb 13, 2023"
Is the iPhone’s ‘Made in India’ era about to begin?,"Feb 11, 2023"
Amazon's customer satisfaction is going down. Here's why,"Feb 9, 2023"
This family of four are driving around Asia in a bus,"Feb 8, 2023"
"'Dear Edward' looks at grief, healing","Feb 6, 2023"
Foxconn January sales hit record high after production restored at world’s biggest iPhone factory,"Feb 6, 2023"
"Apple, Amazon and Google post earnings that disappoint","Feb 3, 2023"
Democratic senator urges Apple and Google to ban TikTok from their app stores,"Feb 2, 2023"
How to live in an airplane (photos),"Feb 2, 2023"
"Apple and Google’s app stores wield ‘gatekeeper’ power and should be reined in, Commerce Department says","Feb 1, 2023"
Apple is the only US tech giant to have avoided significant layoffs. Will it last?,"Feb 1, 2023"
"Apple has infringed on worker rights, NLRB investigators say","Jan 31, 2023"
Jason Segel turns therapy upside down in 'Shrinking',"Jan 30, 2023"
A family of pilots travels the world in a small plane (photos),"Jan 30, 2023"
'Make my dad famous': A daughter's quest to showcase her dad's artwork,"Jan 29, 2023"
Look of the Week: Apple Martin looks every bit the ‘Chanel girl’,"Jan 27, 2023"
How one bio-designer is imagining food of the future,"Jan 27, 2023"
Stocks rise after America’s economy grew more than expected,"Jan 26, 2023"
These two women have visited every country in the world (photos),"Jan 26, 2023"
"Timothée Chalamet wants an Apple TV+ project, too","Jan 25, 2023"
The 2023 MacBook Pro makes our favorite premium laptop even better,"May 30, 2023"
Bratislava’s architecture is out of this world,"Jan 25, 2023"
Lawmakers grill ticketing industry after Taylor Swift concert fiasco,"Jan 24, 2023"
America’s biggest banks are taking on Apple Pay and PayPal,"Jan 24, 2023"
The world’s longest flight was more than two months long,"Jan 24, 2023"
She thought she had a stomach bug. Her Apple Watch alerted her it was more,"Jan 20, 2023"
This woman is riding around the world with her German shepherd,"Jan 16, 2023"
Tim Cook agrees to a massive pay cut,"Jan 13, 2023"
Christina Applegate to make her first awards show appearance since MS diagnosis,"Jan 13, 2023"
Why Apple may finally be embracing touchscreen laptops,"Jan 12, 2023"
How technology is helping aviation to be more sustainable,"Jan 12, 2023"
Apple’s first US labor union reaches new milestone for tech industry,"Jan 11, 2023"
Japan offers world’s most powerful passport,"Jan 10, 2023"
Prince Harry explains why he refers to William as 'arch-nemesis' in new book,"Jan 8, 2023"
Watch: Late night hosts react to Prince Harry's memoir,"Jan 6, 2023"
Apple is raising the price of iPhone battery replacements,"Jan 4, 2023"
These airlines are least likely to delay your flight,"Jan 4, 2023"
World’s largest iPhone factory bounces back from Covid disruption that hurt Apple,"Jan 4, 2023"
Apple has lost $1 trillion in market value in a year,"Jan 3, 2023"
See adorable photo of Anderson's son and Andy's son mimicking their dads on set,"Jan 1, 2023"
